<?xml version="1.0" encoding="UTF-8"?>
<!DOCTYPE biblioteca SYSTEM "biblioteca.dtd">

<biblioteca>
    <libro id="L4897" tipo_clase="novela">
        <titulo>La Divina Comedia</titulo>
        <capitulos>
            <capitulo num="1" pag="10"><contenido>Infierno</contenido></capitulo>
            <capitulo num="2" pag="50"><contenido>Purgatorio</contenido> </capitulo>
            <capitulo num="3" pag="110"><contenido>Paraíso</contenido></capitulo>
        </capitulos>
        <sinopsis>Dante viaja con Virgilio al Infierno</sinopsis>  
    </libro>

    <libro id="L4987">
        <titulo>Guardián sobre el centeno</titulo>
    </libro>

    <revista id="R1568">
        <titulo>ARTE</titulo>
        <numero>15</numero>
    </revista>

    <revista id="R1569">
        <titulo>ARTE</titulo>
        <numero>16</numero>
        <secciones>
            <seccion pag="54"> Otto Dix</seccion>
            <seccion>Hockney</seccion>        
        </secciones>
    </revista>

    <periodico id="P1598" fecha="2020-03-12">
        <titulo>Washington Post</titulo>
        <indice>
            1- Noticiario
            2- Coloquio
            3- Deportes
        </indice>
        <seccionesP>
            <seccionP tipo="nacional"><articulo autor="Prada"><contenido> Mucho texto</contenido></articulo></seccionP>
        </seccionesP> 
    </periodico>
</biblioteca>